appId,title,summary,,,
com.hsv.freeadblockerbrowser,Free Adblocker Browser - Adblock , Private Browser,"Free ad blocker and private browser, block video ads, banner ads and pop up ads!",,
org.adblockplus.browser,"Adblock Browser: Block ads, browse faster","Surf the web without annoying ads. Adblock Browser is fast, secure and free.",,,
com.adguard.android.contentblocker,AdGuard: Content Blocker for Samsung and Yandex,Ad Blocker App: Block All Online Ads in Samsung Internet and Yandex Browser,,,
com.brave.browser,"Brave Private Browser: Fast, secure web browser","Free, safe internet browser! Private browsing, search engine &amp; pop-up blocker.",,,
org.blokada.alarm.dnschanger,"Blokada Slim Ad blocker - No Ads, better battery",Protect your privacy for free with the official Blokada app.,,,
popup.ads.detector,Popup Ad Detector-Detect ad showing outside of app,No more wasting time on finding which app causing pop-up ad!,,,
com.spaceship.netprotect,"AdBlock - Block ad for all browers,ad blocker plus","Faster ad blocker for all browsers(Chrome, Opera, Firefox, UC etc.) Ad Guard! 🎉",,,
org.adblockplus.adblockplussbrowser,Adblock Plus for Samsung Internet - Browse safe.,"Specifically for Samsung Internet: block annoying ads, browse faster, save data.",,,
krow.dev.addetector,Ad Detector,Ad Detector detects advertisement used by your installed applications.,,,
kr.co.lylstudio.unicorn,"Unicorn Blocker:Adblocker, Fast & Private","* block pre-roll ads, pop-up and forced redirect ads
* Samsung certification app",,,
com.appspot.swisscodemonkeys.detector,AppBrain Ad Detector,Find out which of your apps have ads and spyware,,,
com.rocketshipapps.adblockfast,Adblock Fast,"Adblock Fast is a free, open-source ad blocker for Samsung Internet 4.0 and up!",,,
com.imoblife.checkadd_plug_in,Ad Detect Plugin - Handy Tool,"Check ads contained in apps installed, notify when intrusive ads are detected",,,
com.tafayor.appwatch,AppWatch - Popup Ad Detector,Find out which app is causing pop-up ads.,,,
com.rhaon.ad_skip,Ad Skip,You can spend time efficiently by reducing the amount of time you see ads.,,,
com.joettaapps.adblocker,AD Blocker Browser Block Web Content , Adguard,"AdBlock Plus is free AD Blocker web Browser, Content, Popup Block Ads Guard🚫",,
com.alfeugds.adskipper,Ad Skipper,Skips Video Ads while you watch your videos on youtube,,,
me.plusnow.shield.stable,"AdShield - Ad blocker, No more ads & tracking","Powerful Content Blocker for Chrome &amp; other browsers, Block ads and more",,,
com.betafish.adblocksbrowser,AdBlock for Samsung Internet,"Surf the Web faster, safer, and ad-free with AdBlock for Samsung Internet!",,,
com.adblock.App,"AdBlock - Block ad for all Browers,ad blocker plus",AdBlock is an ideal solution for Android mobile devices.,,,
net.browsetech.adremover.android,Ad Remover,Blocks online ads and activity trackers on your Android device.,,,
com.adblocker.turbo.browser,Ad Blocker Turbo - Adblocker Browser,Get an Ad-Free experience with Ad Blocker Turbo browser.No Ads = Lower data plan,,,
com.avg.android.secure.browser,AVG Browser: Fast Browser + VPN , Ad Block,AVG Browser is a fast private browser with built-in VPN ,amp, ad blocker.
pure.lite.browser,"Pure Web Browser-Ad Blocker,Video Download,Private","Fast and mini browser with Ad Blocker,Video Downloader and Privacy Mode",,,
com.ad_detector.airpushdetector,Ads Detector , Airpush Detector (Simple Version),Ads Detector - Airpush Detector is an adware detector that detects adware apps,,
com.tenta.android,Tenta Private VPN Browser + Ad Blocker (Beta),"⚡️ Your private, encrypted browser with built-in VPN for faster secure browsing",,,
com.pure.browser.plus,"Pure Browser Pro-Ad Blocker,Video Download,Player","Fast and mini browser with Ad Blocker,Video Downloader and Video Player",,,
cm.browser.privatewindow.download,"CM Browser - Fast Download, Private, Ad Blocker","Most secure browser, top video download with Ad Blocker",,,
com.pure.mini.browser,Mini Web Browser-Fast , Ad Blocker , Video Player,"Fast and Mini Browser with Ad Blocker,Video download and Video player",
com.duckduckgo.mobile.android,DuckDuckGo Privacy Browser,"Browse the web privately, search anonymously, and escape ad trackers.",,,
com.airpush_detector.ad_blocker,Airpush Detector : Ad Detector,Airpush Detector : Ad Detector is an app to block mobile ads in your phone,,,
com.avast.android.secure.browser,Avast Secure Browser: Fast VPN + Ad Block,Free private browser with built-in VPN and AdBlock for faster secure browsing.,,,
com.skipads.skipyoutubeadsandcommercials,Skip ads for video stream: ad blocker , ad cleaner,Fast skip advertisement ,amp, commercial while playing video to avoid interruption
made.in.india.adfreemusic,Free Ad Guard - auto skip ads,Listen/watch Ad Free content on your favourite music app,,,
com.ume.browser.cust,Ume Browser - Fast , Private , Ad Blocker,"Fast and Secure Browser with Ad blocker,Download Manager and Incognito Mode",
com.github.xfalcon.vhosts,Vpn Hosts (ad blocker , no root , support ipv6 ),"1,no root use customized Hosts File on android.
2,support wildcard DNS records.",
br.marcelo.monumentbrowser,"Monument Browser: Ad Blocker, Privacy Focused",Browse with privacy and download speed booster too!,,,
com.appybuilder.asier_oyanguren.adApp2,Ad App,Tired of watching ads when you didnt want to? Here you can see them in your will,,,
com.vivaldi.browser,Vivaldi Browser with ad blocker: fast , private,"Fast &amp; private web browser with ad blocker, sync, dark &amp; private mode.",,
com.gobest.goclean,"Goclean-Pop up Ad detector,airpush detector",".GoClean is to measure the data usage  
. Ad Detector -pop up ads remover",,,
com.blink.browser,"Bravo Browser-Fast download, Ad Block, Security","Super security &amp; light browser, speed download, powerful  Ad Block and search.",,,
co.madseven.browser,Apolo Browser - Ad Block - Coupon Code,Ad Block Browser Quick Search Engine Antivirus Browser Coupon Code,,,
com.insher.main,Ad Skipper - Skip the Irrelevant,Helps You Skip all the Irrelevant Ads ,amp, Content without explicit clicking,
com.ume.browser.bose,Web Browser - Fast , Private , Ad Blocker,"Fast and Secure Browser with Ad Blocker,Fast Download and Incognito Mode",
com.shaon.pmbrowser,PM Browser - Ad Blocker , Data Saver,"A Fast Secure browser that Data Saver, blocks ads and lets you easily",,
com.sahani2020.blaze,Blazing Web Browser - Fast , Secure | Ad Blocker,Browse/Surf the Internet Fast ,amp, more Secure with Ad blocker and Save your data.
com.kuto.browser,"KUTO Mini Browser-Tiny, Fast, Private, No Ad","Tiny size, powerful features(Privacy tab, Ad block, multi-thread download)",,,
com.droid.netflixIMDB,Ad Skipper and IMDB Rater,Skips Ads and shows IMDb ratings,,,
com.hamatim.adwarehunter,Adware Hunter - Popup Ad Detector , Find Cause,"No more trouble, this app will help you find out what is the cause of the popups",,
com.opera.oxbrowser,"OX Browser : Fast Download, Secure, Ad Block","OX Browser is a fast, simple, data saving and secure browser for Android Phone",,,
org.internetcondom.adblocker,Internet Condom - Ad Blocker,Surf ad-free with Internet Condom.,,,
org.blpomda.alarm,Ad blocker,Very useful ad blocking tool.,,,
s.sdownload.adblockerultimatebrowser,AdBlocker Ultimate Browser,"Crazy fast, secure and free ad blocker browser for Android that blocks ALL ads.",,,
com.seven.adclear.fsb,AdClear Content Blocker,Ad blocking browser extension and DNS changer for Android,,,
ai.blokee.browser.android,Free Adblocker - Bloket Browser (Fast internet),#1 ad blocking internet browser ★ Free download ★ Blocks video ads ,amp, banner ads,
com.rucksack.adblock,"Adblock - No Ads. Better battery, faster browsing.","Adblock - in browser, Android apps. Plus data protection and privacy.",,,
adsblocker.adsskiper.adsblockerbrowser.cuckoo,Skip Ads for Youtube - Auto Skip Youtube Ads,Auto skip and block youtube ads in android.,,,
com.utube.videotube.vanced.kit,Vanced Kit for VideoTube Block All Ads,"A kit developed for easy installation. Non-root, no ads, no microG",,,
com.adblocker.ashazapps,Adblock,Adblock app is best app to  block ads,,,
com.crdev.AdsStopper,Adblock - Block ads from all browsers 2021,his application will allow you to browse the web and all application on ...,,,
co.blocksite,BlockSite - Stay Focused , Control Your Time,BlockSite helps you stay focused by blocking distracting sites and apps.,,
com.agooday.skipads,Skip Ads,"Auto click Skip Ads to skip YouTube ads, set time to pause YouTube video.",,,
io.funswitch.blocker,"BlockerX-Porn blocker,App for no fap & safe search",This porn blocker helps in your no fap journey. Also helps quit porn addiction.,,,
com.av1rus.adblockremover,Ad Block REMOVER - NEED ROOT,"ROOTED PHONES ONLY...
READ DESCRIPTION...",,,
org.adblockplus.browser.beta,"Adblock Browser Beta: Block ads, browse faster","Surf the web without annoying ads. Adblock Browser is fast, secure and free.",,,
com.spear_adblocker,SPEAR-AdBlocker,Samsung Internet AdBlocker,,,
co.crystalapp.crystal,Crystal Adblock for Samsung,"Block Ads in Samsung Internet Browser!
Enjoy faster, secure browsing for free!",,,
co.easy4u.popup.ads.detector,Popup ADs Detector,Detect and get rid of ADs showing outside of app in 3 steps,,,
com.adguard.vpn,"AdGuard VPN — Fast & secure, unlimited protection",Turbo fast ,amp, private VPN by the creators of the best ad blocker. Try for free!,
com.appsisland.ads.shield.content.blocker,Ads-Shield : Content Blocker,Tired of ad pop ups every time you browse internet? Block them at your will now!,,,
com.plustwo.skipads,Skip Ads,"Click ""Skip ads"" button automatically !",,,
com.TripleVGames.Adblocker,Popup Blocker,"It's not an actual AdBlocker, it's a game.",,,
com.maximebertheau.uninstaller,Uninstaller - No ads - No pain,"Multi-app uninstaller, no ads, no pain",,,
app.no.vpn,"noVPN - Forever Free VPN, DNS and Block Ads","Lifetime and forever VPN, DNS and block ads.",,,
com.teqtic.lockmeout,Lock Me Out 🥇 App Blocker , Website Blocker,Set up usage limits or schedule lockouts. Freedom from smartphone addiction! 😌,,
adblock.browser.popup.detector,Browser Popup Detector - Block Ads In Browser,Find which app launches your browser with ads and block ads on the website,,,
com.mosoft.godzilla,Godzilla Browser – AdBlocker  – Fastest Browser,"Fast, ad blocker, browser and reduce internet data usage.",,,
com.ucturbo,"UC Browser Turbo- Fast Download, Secure, Ad Block","Download UC Browser Turbo app - Get a fast, secure and simple browser.",,,
com.mw.applockerblocker,Lock N' Block - App Protector and Blocker,"A real ""Swiss Army Knife"" to protect your apps",,,
com.pt.tool.away,Skip Ads for Apps,This is an auto-skip tool that targets at Smartphone App Ads.,,,
com.consulenza.umbrellacare,Umbrella - Adblock , Firewall,Ad blocking and traffic control,,
com.protectstar.firewall,"No Root Firewall, Internet Data Blocker Protection",The most secure Personal Firewall in the world that fits in your pocket,,,
com.wavesnet.www.mybrowser1,"My Browser(Light&Fast) No Ads,Block Ads","This browser is developed for fast surfing,lite mode",,,
cz.mobilesoft.appblock,AppBlock - Stay Focused (Block Websites , Apps),The best productivity app that helps you reduce the time spent on your phone.,,
com.agooday.skipadspro,Skip Ads Pro,"Auto mute &amp; skip YouTube ads, 
Timer to pause YouTube",,,
co.easy4u.ncleaner,Notification Blocker , Cleaner , Heads-up Off,Keep the notification bar neat and clean ✨,
com.msw.pornblocker,Pure Web - The First Porn Blocker,Pure Web provides the easiest way to block all porn content and adult websites,,,
dnsfilter.android,"personalDNSfilter - block tracking, malware & more","A tiny tool to protect you from tracking, malware and other unwanted content",,,
com.noad.it,NoAd,Finally STOP advertising on applications and browsers.,,,
com.stayfocused,Stay Focused - App , Website Block | Usage Tracker,App Block | Website Blocker | Distraction Blocker | Usage tracker | Self Control,,
com.camhart.pornblocker,Free Porn Filter / Blocker,"Free filter, with premium filter lock and accountability alerts.",,,
com.kiddoware.kidsafebrowser,Safe Browser Parental Control - Blocks Adult Sites,Safe kids search ,amp, safe browser app to block access to unsafe websites.,
com.rucksack.adblock.anti_tracking,"NoTrack - Anti tracking, privacy, data protection",Blocks web trackers for privacy protection. Plus Adblock in browser.,,,
bg.alexxx.playtubeapp,Skip Ads ＆ Non Stop,"Click ""Skip ads"", ""PLAY NOW"" automatically, muting ads while they are playing...",,,
com.xbrowser.play,XBrowser - Super fast and Powerful,Fast mini browser.Less than 1M,Strong ad blocking ability,Clean and Powerful,
com.smsBlocker,"Block Text, Spam Blocker for android","Block text messages, Block email text &amp; Group messages, Text blocker for android",,,
com.bestnewstopadvideoonlinetips.govidestopdeguidetips,Free Block All Ads For Vanced ads Tips walkthrough,step by step Block all ads for app help you to Block all ads on videos.,,,
com.cobalt.app.browser,"Cobalt Web Browser | Fast, Secure, Private","Block Ads - Fast, Private and Secure Browsing with Cobalt Browser.",,,
adblocker.lite.browser,AdBlocker Lite Browser,"Ad blocker Browser is lite weight, save your data &amp; battery &amp; Block Ads.",,,
mobi.mgeek.TunnyBrowser,"Dolphin Browser - Fast, Private & Adblock🐬","Best web browser with flash player, fast download, ad blocker &amp; incognito mode.",,,
net.bluehack.blu,"BLU Internet Browser :AdBlock,Light,Secure & Fast","BLU Internet is a fast, free, secure web browser with a built-in AdBlock.",,,
com.notification.cleaner,Notifications Spam Blocker and Cleaner,"Automatically block ads, junk and spammy notification messages",,,
com.m24apps.appblocker,App Blocker: Stay Focused , No Distractions,Block apps ,amp, websites | Strict Mode | Notification Blocker | App Usage Tracker
com.cake.browser,"Cake Web Browser-Free VPN, Fast, Private, Adblock","Fast web browser with swiping &amp; free unlimited VPN, ad block, private &amp; secure",,,
com.porn.blocker.purity.browser,"Purity - Safe Browser, Porn Block Filter App Block",Porn-free browser that helps you break free from porn. Powered by DuckDuckGo.,,,
com.khashayar.netshield.browsers,NetShield: Free Adblocker for All Browsers,More secure and faster ad blocker for every browser. NetShield,,,
to.freedom.android2,Freedom | Block Distracting Apps and Websites,Be focused and productive – block the apps and websites that distract you.,,,
com.osiris.browser,"Osiris Browser: No Ads, Secure Hyper Speed Browser","Hyper Speed Browser: No Ads, No Surveillance Scripts, Free and Saves Data Fees.",,,
com.blocknotification.gamemode,Game Mode - Block Notifications during Game Play,"Block All notifications during game, no disturbing notifications during gameplay",,,
com.familyfirsttechnology.pornblocker,DETOXIFY - Porn Blocker / App Blocker Accountable,Blocks 2 million+ porn sites. THRIVE! Be the best version of YOU.,,,
com.blocking.sites,Blocker - Free Website and Porn Blocker.,"Are you looking for Website, Porn and Apps Blocker? Then your at right place.",,,
com.amberweather.widget.vip,Block Ads in Amber Widgets,Block push notifications ,amp, Ads in Amber Widgets to have a better weather serive.,
com.hsv.privatebrowser,Private Browser with Adblock , Incognito Browser,"Private Browser with Adblock, Secret browser &amp; Incognito browser for anonymous!",,
com.mebrowser.webapp,Me Browser,"Me Browser is the best browser with ad blocker, this fast, secure browser",,,
entertainment.privatebrowser.vnstore,Incognito Private Browser with Adblock,"Private Browser, No histories, No cookies, No Cache, block all the ads websites",,,
com.glennio.premium,Premium Adfree,Premium Plugin to remove VIDEO DOWNLOADER APP ads **NOT ADS SHOWN BY WEBSITES**,,,
com.cosmic.webbrowser,"Cosmic Browser: Fast, Safe, Private & Ad-blocker","A fast, safe, and light web browser with gestures support and Ad-blocker",,,
com.jawaid.firebrowser,Leo Browser,Fast Internet Browser With Responsive Design And Ad Blocker,,,
com.amber.vip.ad,Ad Blocker Plug-in for Amber Widgets,Full refund (100% money back guarantee) if app does not work as described.,,,
com.notic,Notification blocker. Notification cleaner,Take control over your notification Bar,,,
com.thmf.as.skip_ads,Simple Video Ads Skipper 🚫,"Automatically skip video ads of YouTube, Twitch,POOQ, AfreecaTV, NaverTV, oksusu",,,
com.techproof.websiteblocker,Porn Site Blocker , Graphic Violence - WebBlocker,"Lets you block all PORN🔞, graphic violence☠️ &amp; gambling/betting websites online",,
org.triple.banana,"Banana Browser (Adblock, DNS over HTTP / HTTPS)","Fast &amp; secure browser: Adblock, Secure DNS, Dark Mode, Secure Login",,,
com.rotech.bloqueiaanuncios,Bloqueia Anúncios,"Blocks ads on major browsers, youtube, apps, and games.",,,
com.elrond.maiar,"Maiar Browser: Blazing fast, privacy first browser","Next generation browser with ad-blocker, for more speed, security and privacy",,,
pcr.browser.polarity,Polarity Browser-Fast/No Ads,"Polarity is a fast, ad free, and private browser with adblock and incognito.",,,
com.mario.app.protection,Sexual Pron Sites , Ads Adult  Blocker,All Porn | sex WebSites | Adult | Ads Blocker,,
com.amber.vip.launcher.ad,Ad Blocker Plug-in for Launcher,Full refund (100% money back guarantee) if app does not work as described.,,,
com.vmining.AdBlockPlus,AdStop - ad blocker from all browsers 2021,ad blocking in all browsers,,,
com.outcoder.browser,"Surfy Browser - Best UI, AdBlock, Text-to-Speech",Listen to pages. True full-screen. Password protection. Ad blocker. Incognito,,,
com.atominvention.atombrowser,"Cube Browser (Ads Blocking, Batch photo download)",Cube Browser is a light and fast browser for your everyday web browsing,,,
com.fast.turbobrowser,Turbo Browser- Fast And Secure with Ad Block,Turbo Browser It is specifically designed for mobile phones.,,,
com.epic.browser,"Epic Privacy Browser - AdBlocker, Vault, Free VPN",Built on Chromium to be Fast ,amp, Secure. Engineered to Keep Your Browsing Private.,
com.kawkaw.pornblocker.safebrowser.up,Porn Blocker : Safe Search , Web Filter,Porn blocker that makes internet more safe,,
com.expecode.toweb,XOBROWSER - Ads block , video download,Full-featured mobile browser,,
com.hanstudio.notifyblocker,Notification Cleaner , Blocker , Screen Lock,"Clean Notifications Smartly , Easily and  Screen Lock, APK Transfer, App Sharing",
matt.playtube.videotube.vancedtube,Vanced Tube - Free Block Ads for Video Tube,"Block Ads for Video Tube, Play in both full screen or floating popup window mode",,,
ru.khd.lib.ads,Плагин ADS +,Plugin to disable ads,,,
app.adlocker,AdLocker - Free Adblock , Firewall,Ad blocking and traffic control,,
com.naver.whale,Naver Whale Browser,"A fast, easy, customizable browser supporting sync and blocking abusive ads.",,,
com.magellanbrowser.adblocker,Magellan Browser - Free , Fast Adblocker,"Magellan is Ad-free, high-speed and customizable web browser.",,
com.sibimobilelab.amazebrowser,Amaze Browser. Cast web videos,"Adblock, detect, play, download, cast web video/audio to Chromecast &amp;bubble mode",,,
com.cookiegames.smartcookie,SmartCookieWeb: Secure Web Browser,A free and open source web browser that blocks ads and trackers.,,,
com.androidbull.incognito.browser,Incognito Browser - Private Browser with AdBlock!,An ultra secure Incognito browser to surf the web privately [with an Ad-blocker],,,
com.merxury.blocker,Blocker - App Component Controller,"An useful tools that controls activities and broadcasts, etc.",,,
com.lechneralexander.privatebrowser,Private Browser,"Private Internet Browser, surf Incognito, all Private Data gets deleted. No Ads!",,,
com.uc.browser1,"New UC Browser - Fast Download, Private, Ad block",New CU browser mini improve your browsing speed 🚀,,,
com.airdatatech.optima,Браузер Optima - с поддержкой AdBlock , Extensions,Fast and secure browser with extension support and ad blocking.,,
live.teekamsuthar.mutify,Mutify - Mute annoying ads,"A powerful, light-weight &amp; free Spotify Ad silencing app. [Read Description⬇]",,,
com.blindcut.flutter.browser,Datacappy Ad Blocking Browser,Datacappy Ad Blocking Browser,,,
app.stampy.browser,"Stampy Browser: AdBlocker, Incognito and Secure","Stampy Browser: fast, secure, no ads. Browse fast: adblocker, incognito, privacy",,,
com.mobisoft.webguard,Guard My Web Adblock VPN,Guard My Web is a unique no root ad blocker with VPN privacy,,,
com.vpngalaxy.app,VPN Galaxy - VPN Proxy , AdBlock,VPN Galaxy offers you opportunity to enjoy the internet unlimitedly and freely!,,
com.securebrowser.private.safesearch.adblock,Muscat Lite – Secure Private Browser , Safe Search,Surf securely without ads ,amp, easy clear history in Muscat incognito browser
com.rotech.adblock,Bloqueia Anúncios,"Blocks ads on major browsers, youtube, apps and games.",,,
com.indian.browser.fast.web.browsing.free,Indian Browser,"Indian Browser is Fast, Secure, Data Saving, Ad Blocker, Private Browser",,,
com.stealthmobile.browser,Stealth Browser - Fast Private,"The BEST free browser for speed, privacy and an 'AD-FREE' browsing experience.",,,
com.nationaledtech.spinbrowser,SPIN Safe Browser: Best Filtered Website Browser,Best Nudity/Pornography Blocker and Dangerous Adult Content Filter  🚫Ad-Free 🚫,,,
com.antiporn.pornoblock.safebrowser,Porn , Ads blocker browser,"A porn blocker and ads blocker, blocking all famous known porn websites",,
com.adblock.skipads,Auto Skip Ads Pro - Adblocker,Effective way to skip annoying ads,,,
com.wProxyBrowser_10222471,Proxy Browser - Adblock Secured Private Tor Proxy,"Proxy Browser is a Private, Secured Browser with Adblock &amp; Tor Proxy connection",,,
com.segfaultstudios.suckmyads,Suck My Ads!      ✦(root)✦,'Cause you don't need to buy more stuff,,,
appinventor.ai_DaProgramerForBatch.TinyProxy_Paid,TinyProxy - Webproxy , Adblock,TinyProxy is a simple and tiny web proxy for accessing blocked websites.,,
com.thefrenchsoftware.radiomusicbox,AdBlock Radio, or how to listen to your favourite WEB Radio without advertising,,,
com.india.ucbrowser,"Fast browser- Ad blocker, Secure,fast downloads",Browse Internet At Lightning speeds with inbuilt intelligent ad blocker,,,
com.laggame.musicadblock,Music Adblock,Music Adblock mutes music volume when a Spotify ad is playing.,,,
com.blocker.adblockxprotector,AdBlock X Protector,Protect your device,,,
com.mini.web.browser,Sunflower Browser,"Fast browser with private space,ad blocker,video download and incognito mode",,,
com.emmanuelmolefi.skipadsapp,Skip Ads App,Skip Ads App is a productivity tool to automate skipping ads and much more.,,,
com.wTopTon_11625919,Free and Fast Browser : TopTon,"Fast, secure browser-data savings, ad blocker,  fast downloading.",,,
id.mukti.app.adblockuiandroid,AdBlock UI For Pi-Hole,This is a convenient layer application for Pi-Hole setup.,,,
care4u.browsecare,Browse Care,"Indian Browser with high speed download, light size,ad blocker",,,
com.gc.adsSkipads,Ads Skip Your Ads,Ads Skip Your Ads will skip utube ads for you.,,,
com.skip.video.ads,Skip Ads,Automatically remove and mute Ads,,,
mtc.milesthecreator.adsaway,Ads away,A click a day keeps the ads away!,,,
com.AugmentedWorld.NOMOREADS,NO MORE ADS!,Ad's are invading your system. Shoot the ads or all will be lost...,,,
com.pandora.browser,"Pando Browser - Adsblock, Superfast, IPFS",Web Browser,,,
com.farestld.black_tiger_browser,"Black Tiger Browser with Adsblock ,Private & Fast","Black Tiger Browser pro with Adsblock ,safe,Private,and Fast",,,
com.everaccountable.bulldog,Bulldog Blocker – Free Porn Filter , App Blocker,"Banish porn! Simple, free, and tough porn filter. With built-in app blocking.",,
com.orbitum.browser,Orbitum Browser,Fast browser that blocks annoying ads!,,,
fishpowered.best.browser,"Fishpowered browser - less bull, more cat","Browser with podcast mode, gestures, ad blocker, night mode, privacy, speed...",,,
ru.sputnik.browser,Спутник / Браузер,Safe and fast browser with blocking of the Russian advertising!,,,
